{
  "schema_version": 1,
  "tool": "lj-step0-pc-tests",
  "tool_version": "1.0.0",
  "generated_utc": "2026-10-20T07:30:00Z",
  "powershell": {
    "version": "5.1.22621.4391",
    "edition": "WindowsPowerShell"
  },
  "os": {
    "platform": "windows",
    "caption": "Microsoft Windows 11 Home",
    "version": "10.0.22631",
    "build": "22631.4317",
    "edition_id": "Core",
    "architecture": "64-bit"
  },
  "cpu": {
    "name": "11th Gen Intel(R) Core(TM) i3-1115G4 @ 3.00GHz",
    "cores": 2,
    "logical": 4
  },
  "ram": {
    "total_gb": 7.8
  },
  "gpus": [],
  "vulkan": {
    "runtime_dll_present": false,
    "vulkaninfo_found": false,
    "devices": []
  },
  "disks": [
    {
      "drive": "C",
      "type": "fixed",
      "fs": "NTFS",
      "size_gb": 237.9,
      "free_gb": 61.5
    }
  ],
  "display": {
    "primary": {
      "width": 1366,
      "height": 768,
      "refresh_hz": 60,
      "scale_percent": 100
    },
    "count": 1
  },
  "tools": {
    "ffmpeg": {
      "found": true,
      "version": "7.1-full_build-www.gyan.dev",
      "notes": "found on PATH; the path is not recorded",
      "has_libx264": true,
      "has_libass": true,
      "has_zscale": true,
      "sha256": "3f2a9c41d7e85b60a1c4e9f0b2d37a85c6e1f4092b8d3a7e5c1f60d9b4a28e73"
    },
    "ffprobe": {
      "found": true,
      "version": "7.1-full_build-www.gyan.dev",
      "notes": "found on PATH; the path is not recorded"
    },
    "python": {
      "found": true,
      "version": "3.13.15",
      "notes": "found through the py launcher"
    },
    "git": {
      "found": true,
      "version": "2.55.0",
      "notes": "found on PATH"
    },
    "winget": {
      "found": true,
      "version": "1.9.25200",
      "notes": "found on PATH"
    },
    "magick": {
      "found": false,
      "version": null,
      "notes": "not found"
    },
    "inkscape": {
      "found": false,
      "version": null,
      "notes": "not found"
    },
    "blender": {
      "found": false,
      "version": null,
      "notes": "not found"
    },
    "wsl": {
      "found": false,
      "version": null,
      "notes": "not found on PATH"
    },
    "veracrypt_installed": false
  },
  "craft_apps": {
    "tools_roots_scanned": [],
    "found": [],
    "not_found": [
      "photocraft",
      "vectorcraft",
      "lightcraft",
      "filmcraft",
      "effectcraft",
      "soundcraft"
    ]
  },
  "local_accounts_count": 2,
  "claude_desktop_running": false,
  "redaction": {
    "user_name_removed": true,
    "machine_name_removed": true,
    "paths_generalised": true,
    "self_scan_passed": true,
    "patterns_version": 1,
    "name_hits_in_hardware_fields": []
  },
  "notes": [],
  "errors": []
}
